{
  "name": "Puncher",
  "description": "Melee brawler who sustains through self-healing",
  "detailed_description": "Punchers are straightforward: get in range, hit things, patch yourself up when needed. No resource management, no complexity. What you see is what you get.",
  "colors": { "major": "CC4400", "minor": "884400" },
  "resource": { "name": "stamina", "color": "CC4400", "max": 10, "decay": 0 },
  "abilities": [
    {
      "name": "Punch",
      "range": 5,
      "sound_from": { "type": "boom", "duration": 0.1, "volume": 0.8 },
      "effects": [
        { "type": "harm", "base": 1, "tags": ["physical"] }
      ]
    },
    {
      "name": "Quench",
      "effects": [
        { "type": "heal", "target": "self", "base": 1 }
      ]
    }
  ]
}
